# name: test/sql/geo/ducklake_geometry_merge.test
# group: [geo]

require ducklake

require parquet

test-env DUCKLAKE_CONNECTION {TEST_DIR}/{UUID}.db

test-env DATA_PATH {TEST_DIR}

statement ok
ATTACH 'ducklake:{DUCKLAKE_CONNECTION}' AS ducklake (DATA_PATH '{TEST_DIR}/ducklake_files', METADATA_CATALOG 'ducklake_meta')

statement ok
USE ducklake;

statement ok
create table t1 (i INT, g GEOMETRY);

statement ok
insert into t1 VALUES (1, 'POINT(1 2)'::GEOMETRY);

query II
select * from t1;
----
1	POINT (1 2)

# Merge into
statement ok
MERGE INTO t1 USING
 	(SELECT 1 as i, 'LINESTRING Z (5 5 5, 10 10 10)'::GEOMETRY AS g) AS src
	ON t1.i = src.i
	WHEN MATCHED THEN UPDATE
	WHEN NOT MATCHED THEN INSERT;

query II
select * from t1;
----
1	LINESTRING Z (5 5 5, 10 10 10)

# Normal update
statement ok
UPDATE t1 SET g = 'POINT(3 4)'::GEOMETRY WHERE i = 1;

query II
select * from t1;
----
1	POINT (3 4)

# Also test with an alter table
statement ok
ALTER TABLE t1 ADD COLUMN g2 geometry;

statement ok
UPDATE t1 SET g2 = 'POINT(7 8)'::GEOMETRY WHERE i = 1

query III
select * from t1;
----
1	POINT (3 4)	POINT (7 8)
