# name: test/sql/cleanup/drop_table_cleans_delete_files.test
# description: Dropping a transaction-local table must clean up both deletion files and data files
# group: [cleanup]

require ducklake

require parquet

test-env DUCKLAKE_CONNECTION {TEST_DIR}/{UUID}.db

test-env DATA_PATH {TEST_DIR}

statement ok
ATTACH 'ducklake:{DUCKLAKE_CONNECTION}' AS ducklake (DATA_PATH '{DATA_PATH}/ducklake_drop_delete_cleanup', DATA_INLINING_ROW_LIMIT 0)

statement ok
BEGIN

statement ok
CREATE TABLE ducklake.tbl AS SELECT i id FROM range(1000) t(i);

# data file exists
query I
SELECT COUNT(*) FROM glob('{DATA_PATH}/ducklake_drop_delete_cleanup/main/tbl/*.parquet')
----
1

statement ok
DELETE FROM ducklake.tbl WHERE id % 2 = 0;

# delete file exists
query I
SELECT COUNT(*) FROM glob('{DATA_PATH}/ducklake_drop_delete_cleanup/main/tbl/*-delete.*')
----
1

statement ok
DROP TABLE ducklake.tbl

# both data files and delete files should be cleaned up
query I
SELECT COUNT(*) FROM glob('{DATA_PATH}/ducklake_drop_delete_cleanup/main/tbl/*.parquet')
----
0

query I
SELECT COUNT(*) FROM glob('{DATA_PATH}/ducklake_drop_delete_cleanup/main/tbl/*-delete.*')
----
0

statement ok
COMMIT
