# name: test/sql/rowid/ducklake_row_id.test
# description: test ducklake row-id tracking
# group: [ducklake]

require ducklake

require parquet

statement ok
ATTACH 'ducklake:__TEST_DIR__/ducklake_rowid.db' AS ducklake (DATA_PATH '__TEST_DIR__/ducklake_rowid_files', METADATA_CATALOG 'ducklake_meta')

statement ok
CREATE TABLE ducklake.test(i INTEGER);

statement ok
BEGIN

statement ok
INSERT INTO ducklake.test SELECT i FROM range(3) t(i)

statement ok
INSERT INTO ducklake.test SELECT i FROM range(5, 7) t(i)

statement ok
COMMIT

statement ok
INSERT INTO ducklake.test SELECT i FROM range(10, 15) t(i)

query II
SELECT rowid, i FROM ducklake.test
----
0	0
1	1
2	2
3	5
4	6
5	10
6	11
7	12
8	13
9	14

statement ok
DELETE FROM ducklake.test WHERE i%2=1

query II
SELECT rowid, i FROM ducklake.test
----
0	0
2	2
4	6
5	10
7	12
9	14
