# name: test/sql/rewrite_data_files/test_last_snapshot_rewrite.test
# description: Test calling the delete rewrite function multiple times, over a series of deletes, test the threshold parameter behaves well
# group: [rewrite_data_files]

require ducklake

require parquet

test-env DUCKLAKE_CONNECTION __TEST_DIR__/{UUID}.db

test-env DATA_PATH __TEST_DIR__


statement ok
ATTACH 'ducklake:${DUCKLAKE_CONNECTION}' AS ducklake (DATA_PATH '${DATA_PATH}/ducklake_rewrite_data', METADATA_CATALOG 'ducklake_metadata')

statement ok
USE ducklake

# Start off with simple case
statement ok
CREATE TABLE test(key INTEGER, values VARCHAR);

statement ok
INSERT INTO test SELECT i, concat('thisisastring_', i) FROM range(10000) t(i)

# Let's do three rounds of deletions
statement ok
DELETE FROM test
WHERE key < 1000;

statement ok
DELETE FROM test
WHERE key > 9000;

statement ok
DELETE FROM test
WHERE key > 5000;

query II
SELECT snapshot_id, changes FROM snapshots();
----
0	{schemas_created=[main]}
1	{tables_created=[main.test]}
2	{tables_inserted_into=[1]}
3	{tables_deleted_from=[1]}
4	{tables_deleted_from=[1]}
5	{tables_deleted_from=[1]}

query I
SELECT delete_file is not null FROM ducklake_list_files('ducklake', 'test')
----
True

query I
SELECT delete_file_id FROM ducklake_metadata.ducklake_delete_file
----
3

# This won't do much, since our default threshold is too high
query III
SELECT table_name, files_processed, files_created FROM ducklake_rewrite_data_files('ducklake', 'test')
----

query I
SELECT delete_file_id FROM ducklake_metadata.ducklake_delete_file
----
3

query III
SELECT table_name, files_processed, files_created FROM ducklake_rewrite_data_files('ducklake', 'test', delete_threshold => 0.5)
----
test	1	1

# We are deleting more than one file, so we can get it out
query I
SELECT delete_file_id FROM ducklake_metadata.ducklake_delete_file
----
3

query I
SELECT COUNT(*) from test
----
4001

# Let's do one more deletion to test the global setting
statement ok
CALL ducklake.set_option('rewrite_delete_threshold', 0.1)

statement ok
DELETE FROM test
WHERE key > 4000;

query I
SELECT delete_file_id FROM ducklake_metadata.ducklake_delete_file
----
3
5

query III
SELECT table_name, files_processed, files_created FROM ducklake_rewrite_data_files('ducklake', 'test')
----
test	1	1

query I
SELECT delete_file_id FROM ducklake_metadata.ducklake_delete_file
----
3
5

query I
SELECT COUNT(*) from test
----
3001

statement ok
DELETE FROM test
WHERE key = 3000;

statement ok
CALL ducklake_flush_inlined_data('ducklake')

query III
SELECT table_name, files_processed, files_created FROM ducklake_rewrite_data_files('ducklake', 'test')
----

query I
SELECT delete_file_id FROM ducklake_metadata.ducklake_delete_file
----
3
5
7

# Test that a manual delete_threshold option has priority over the global value.
query III
SELECT table_name, files_processed, files_created FROM ducklake_rewrite_data_files('ducklake', 'test', delete_threshold => 0)
----
test	1	1


# Try invalid values for threshold
statement error
CALL ducklake_rewrite_data_files('ducklake', 'test', delete_threshold => -1);
----
The delete_threshold option must be between 0 and 1

statement error
CALL ducklake.set_option('rewrite_delete_threshold', -1)
----
The rewrite_delete_threshold must be between 0 and 1

# Test cleanup
query I
SELECT COUNT(*) FROM GLOB('${DATA_PATH}/ducklake_rewrite_data/**/*')
----
9

# delete the old files
statement ok
CALL ducklake_cleanup_old_files('ducklake', cleanup_all => true);

# We can safely remove 3 deleted files
query I
SELECT COUNT(*) FROM GLOB('${DATA_PATH}/ducklake_rewrite_data/**/*')
----
7

# Let's check every snapshot has the right answer
# Snapshots 0-8 are identical in both inline and non-inline modes.
# In inline mode there is an extra inlined_delete snapshot (9) and flush snapshot (10) before the final rewrite (11).
# In non-inline mode the delete goes directly to tables_deleted_from (9) and then the final rewrite (10).
# Use dynamic checks to handle both modes.

# Verify the common snapshots (0-8) are always present
query I
SELECT count(*) FROM snapshots() WHERE snapshot_id <= 8
----
9

# Verify overall snapshot structure
query I
SELECT count(*) FROM snapshots() WHERE changes::VARCHAR LIKE '%rewrite_delete%=[1]%'
----
3

query I
SELECT count(*) FROM snapshots() WHERE changes::VARCHAR LIKE '%tables_inserted_into%=[1]%'
----
1

# Time travel: versions 3-8 are the same in both modes
query I
select count(*) from test AT (VERSION => 3);
----
9000

query I
select count(*) from test AT (VERSION => 4);
----
8001

query I
select count(*) from test AT (VERSION => 5);
----
4001

query I
select count(*) from test AT (VERSION => 6);
----
4001

query I
select count(*) from test AT (VERSION => 7);
----
3001

query I
select count(*) from test AT (VERSION => 8);
----
3001

# Versions 9+ differ between inline and non-inline modes.
# In both modes, after version 8 the remaining snapshots all have count=3000.
# Use dynamic snapshot IDs for the remaining versions.
statement ok
SET VARIABLE s_last = (SELECT max(snapshot_id) FROM ducklake_snapshots('ducklake'))

query I
select count(*) from test AT (VERSION => 9);
----
3000

query I
select count(*) from test AT (VERSION => getvariable('s_last'));
----
3000

