# name: test/sql/rewrite_data_files/test_rewrite_inlined_file_deletes_add_files.test
# description: rewrite_data_files should rewrite imported files that only have inlined file deletions
# group: [rewrite_data_files]

require ducklake

require parquet

test-env DUCKLAKE_CONNECTION __TEST_DIR__/{UUID}.db

test-env DATA_PATH __TEST_DIR__

statement ok
ATTACH 'ducklake:${DUCKLAKE_CONNECTION}' AS ducklake (DATA_PATH '${DATA_PATH}/rewrite_inlined_file_deletes_add_files', DATA_INLINING_ROW_LIMIT 10, METADATA_CATALOG 'ducklake_meta')

statement ok
USE ducklake

statement ok
CREATE TABLE t(a INTEGER)

statement ok
COPY (SELECT i::INTEGER AS a FROM range(50) t(i)) TO '${DATA_PATH}/source.parquet'

statement ok
CALL ducklake_add_data_files('ducklake', 't', '${DATA_PATH}/source.parquet')

query I
SELECT count(*) FROM t
----
50

statement ok
DELETE FROM t WHERE a = 25

query I
SELECT count(*) FROM t
----
49

query I
SELECT count(*) FROM ducklake_meta.ducklake_delete_file WHERE end_snapshot IS NULL
----
0

query I
SELECT count(*) FROM ducklake_meta.ducklake_inlined_delete_1
----
1

query III
SELECT table_name, files_processed, files_created FROM ducklake_rewrite_data_files('ducklake', 't', delete_threshold => 0)
----
t	1	1

query I
SELECT count(*) FROM t
----
49

query I
SELECT count(*) FROM ducklake_meta.ducklake_data_file WHERE end_snapshot IS NULL
----
1

statement ok
SET VARIABLE rewrite_snap = (SELECT max(snapshot_id) FROM ducklake_snapshots('ducklake'))

query I
SELECT count(*) FROM ducklake_meta.ducklake_data_file WHERE begin_snapshot = getvariable('rewrite_snap') AND end_snapshot IS NULL
----
1
