# name: test/sql/table_changes/ducklake_table_insertions.test
# description: test ducklake table_changes function
# group: [ducklake]

require ducklake

require parquet

statement ok
ATTACH 'ducklake:__TEST_DIR__/ducklake_table_changes.db' AS ducklake (DATA_PATH '__TEST_DIR__/ducklake_table_changes_files', METADATA_CATALOG 'xx')

# snapshot 1
statement ok
CREATE TABLE ducklake.test(i INTEGER);

# snapshot 2
statement ok
INSERT INTO ducklake.test VALUES (1)

# snapshot 3
statement ok
INSERT INTO ducklake.test VALUES (2)

# snapshot 4
statement ok
INSERT INTO ducklake.test VALUES (3)

# snapshot 5
statement ok
INSERT INTO ducklake.test VALUES (NULL)

# snapshot 6
statement ok
INSERT INTO ducklake.test FROM range(10, 12)

query II
SELECT rowid, * FROM ducklake_table_insertions('ducklake', 'test', 0, 2);
----
0	1

query II
SELECT rowid, * FROM ducklake_table_insertions('ducklake', 'test', 0, 3);
----
0	1
1	2

query II
SELECT rowid, * FROM ducklake_table_insertions('ducklake', 'test', 0, 4);
----
0	1
1	2
2	3

query II
SELECT rowid, * FROM ducklake_table_insertions('ducklake', 'test', 4, 5);
----
2	3
3	NULL

query II
SELECT rowid, * FROM ducklake_table_insertions('ducklake', 'test', 5, 5);
----
3	NULL

# snapshot 7: update a subset of the rows
statement ok
UPDATE ducklake.test SET i=i+100 WHERE i < 11

query II
SELECT rowid, * FROM ducklake_table_insertions('ducklake', 'test', 7, 7) ORDER BY rowid
----
0	101
1	102
2	103
4	110

query II
SELECT rowid, * FROM ducklake_table_insertions('ducklake', 'test', 0, 7) ORDER BY rowid
----
0	101
1	102
2	103
3	NULL
4	110
5	11

# snapshot 8: delete a subset of the rows
statement ok
DELETE FROM ducklake.test WHERE i>100

# snapshot 9: delete all rows
statement ok
DELETE FROM ducklake.test

# there are insertions between these two snapshots
query II
SELECT rowid, * FROM ducklake_table_insertions('ducklake', 'test', 0, 8) ORDER BY rowid
----
3	NULL
5	11

# but everything has been cleared here
query II
SELECT rowid, * FROM ducklake_table_insertions('ducklake', 'test', 0, 9) ORDER BY rowid
----
