# name: test/sql/constraints/not_null.test
# description: test NOT NULL constraint
# group: [constraints]

require ducklake

require parquet

test-env DUCKLAKE_CONNECTION __TEST_DIR__/{UUID}.db

test-env DATA_PATH __TEST_DIR__


statement ok
ATTACH 'ducklake:${DUCKLAKE_CONNECTION}' AS ducklake (DATA_PATH '${DATA_PATH}/ducklake_not_null_files')

statement ok
CREATE TABLE ducklake.test(i INTEGER NOT NULL, j INTEGER);

statement ok
INSERT INTO ducklake.test VALUES (42, NULL);

statement error
INSERT INTO ducklake.test VALUES (NULL, 84)
----
NOT NULL constraint

# check that NOT NULL shows up in DESCRIBE
query IIIIII
DESCRIBE ducklake.test
----
i	INTEGER	NO	NULL	NULL	NULL
j	INTEGER	YES	NULL	NULL	NULL

# we cannot add a null constraint to a column that already has it
statement error
ALTER TABLE ducklake.test ALTER i SET NOT NULL;
----
already

# we cannot drop the null constraint from a column that does not have it
statement error
ALTER TABLE ducklake.test ALTER j DROP NOT NULL;
----
no NOT NULL constraint

# column does not exist
statement error
ALTER TABLE ducklake.test ALTER nonexistent_column SET NOT NULL;
----
nonexistent_column

statement error
ALTER TABLE ducklake.test ALTER nonexistent_column DROP NOT NULL;
----
nonexistent_column

# we can drop the NOT NULL constraint
statement ok
ALTER TABLE ducklake.test ALTER i DROP NOT NULL;

# we can then re-add it - and roll it back
statement ok
BEGIN

statement ok
ALTER TABLE ducklake.test ALTER i SET NOT NULL;

statement ok
ROLLBACK

# if we re-add, we cannot add NULL values in the same transaction
statement ok
BEGIN

statement ok
ALTER TABLE ducklake.test ALTER i SET NOT NULL;

statement error
INSERT INTO ducklake.test VALUES (NULL, 42)
----
NOT NULL constraint failed

statement ok
ROLLBACK

# if we re-add, we cannot add NULL values in the same transaction
statement ok
BEGIN

statement ok
INSERT INTO ducklake.test VALUES (NULL, 84)

statement error
ALTER TABLE ducklake.test ALTER i SET NOT NULL;
----
transaction-local

statement ok
ROLLBACK

# we cannot SET NOT NULL on a table that has NULL values
statement error
ALTER TABLE ducklake.test ALTER j SET NOT NULL;
----
has NULL values

# after dropping the constraint - we can add NULL rows
statement ok
INSERT INTO ducklake.test VALUES (NULL, 84)

# setting NOT NULL should inspect the live rows, not only stale insert-time stats
statement ok
CREATE TABLE ducklake.issue_1158(i INTEGER);

statement ok
INSERT INTO ducklake.issue_1158 VALUES (NULL), (1);

statement ok
DELETE FROM ducklake.issue_1158 WHERE i IS NULL;

query I
SELECT count(*) FROM ducklake.issue_1158 WHERE i IS NULL;
----
0

statement ok
ALTER TABLE ducklake.issue_1158 ALTER i SET NOT NULL;

statement error
INSERT INTO ducklake.issue_1158 VALUES (NULL);
----
NOT NULL constraint failed

statement ok
CREATE TABLE ducklake.issue_1158_transaction(i INTEGER);

statement ok
INSERT INTO ducklake.issue_1158_transaction VALUES (NULL), (1);

statement ok
BEGIN;

statement ok
DELETE FROM ducklake.issue_1158_transaction WHERE i IS NULL;

statement ok
ALTER TABLE ducklake.issue_1158_transaction ALTER i SET NOT NULL;

statement ok
COMMIT;

statement error
INSERT INTO ducklake.issue_1158_transaction VALUES (NULL);
----
NOT NULL constraint failed
