# name: test/sql/delete/delete_add_files_creates_delete_dir.test
# description: DELETE should create the table data directory before writing delete files for add_data_files tables
# group: [delete]

require ducklake

require parquet

test-env DUCKLAKE_CONNECTION {TEST_DIR}/{UUID}.db

test-env DATA_PATH {TEST_DIR}

statement ok
ATTACH 'ducklake:{DUCKLAKE_CONNECTION}' AS ducklake (DATA_PATH '{DATA_PATH}/delete_add_files_creates_delete_dir', DATA_INLINING_ROW_LIMIT 5, METADATA_CATALOG 'ducklake_meta')

statement ok
USE ducklake

statement ok
CREATE TABLE t(id INTEGER)

statement ok
COPY (SELECT i::INTEGER AS id FROM range(100) t(i)) TO '{DATA_PATH}/source.parquet'

statement ok
CALL ducklake_add_data_files('ducklake', 't', '{DATA_PATH}/source.parquet')

query I
SELECT count(*) FROM t
----
100

statement ok
DELETE FROM t WHERE id BETWEEN 10 AND 40

query I
SELECT count(*) FROM t
----
69

query I
SELECT count(*) FROM ducklake_meta.ducklake_delete_file WHERE end_snapshot IS NULL
----
1