# name: test/sql/compaction/rewrite_deletes_full_file_delete_after_flush.test
# description: rewrite_deletes should handle a fully deleted file created by ducklake_flush_inlined_data
# group: [compaction]

require ducklake

require parquet

test-env DUCKLAKE_CONNECTION {TEST_DIR}/{UUID}.db

test-env DATA_PATH {TEST_DIR}


statement ok
ATTACH 'ducklake:{DUCKLAKE_CONNECTION}' AS ducklake (DATA_PATH '{DATA_PATH}/rewrite_deletes_full_file_delete_after_flush', DATA_INLINING_ROW_LIMIT 100, METADATA_CATALOG 'ducklake_meta')

statement ok
USE ducklake;

statement ok
CREATE TABLE t (id INTEGER);

statement ok
INSERT INTO t SELECT i FROM range(20) tbl(i);

query I
SELECT COUNT(*) FROM ducklake_meta.ducklake_data_file WHERE end_snapshot IS NULL;
----
0

statement ok
SET VARIABLE v_after_insert = (SELECT max(snapshot_id) FROM ducklake_snapshots('ducklake'));

query I
SELECT COUNT(*) FROM t AT (VERSION => getvariable('v_after_insert'))
----
20

statement ok
DELETE FROM t WHERE id < 20;

statement ok
SET VARIABLE v_after_delete = (SELECT max(snapshot_id) FROM ducklake_snapshots('ducklake'));

query I
SELECT COUNT(*) FROM t;
----
0

query I
SELECT COUNT(*) FROM t AT (VERSION => getvariable('v_after_insert'))
----
20

query I
SELECT COUNT(*) FROM t AT (VERSION => getvariable('v_after_delete'))
----
0

query I
SELECT COUNT(*) FROM ducklake_flush_inlined_data('ducklake');
----
1

query I
SELECT COUNT(*) FROM t AT (VERSION => getvariable('v_after_insert'))
----
20

query I
SELECT COUNT(*) FROM t AT (VERSION => getvariable('v_after_delete'))
----
0

query II
SELECT COUNT(*), COALESCE(SUM(record_count), 0) FROM ducklake_meta.ducklake_data_file WHERE end_snapshot IS NULL;
----
1	20

query II
SELECT COUNT(*), COALESCE(SUM(delete_count), 0) FROM ducklake_meta.ducklake_delete_file WHERE end_snapshot IS NULL;
----
1	20

query II
SELECT COUNT(*), SUM(files_created) FROM ducklake_rewrite_data_files('ducklake', 't', delete_threshold => 0);
----
1	0

query I
SELECT COUNT(*) FROM t AT (VERSION => getvariable('v_after_insert'))
----
20

query I
SELECT COUNT(*) FROM t AT (VERSION => getvariable('v_after_delete'))
----
0

query I
SELECT COUNT(*) FROM t;
----
0
