# name: test/sql/partitioning/partition_nop.test
# description: Test partitioning nop options.
# group: [partitioning]

require ducklake

require parquet

# partitioning based on a column
test-env DUCKLAKE_CONNECTION {TEST_DIR}/{UUID}.db

test-env DATA_PATH {TEST_DIR}


statement ok
ATTACH 'ducklake:{DUCKLAKE_CONNECTION}' AS ducklake (DATA_PATH '{DATA_PATH}/ducklake_partitioning_nop', METADATA_CATALOG 'ducklake_metadata', DATA_INLINING_ROW_LIMIT 0)

statement ok
USE ducklake

statement ok
CREATE TABLE partitioned_tbl(part_key INTEGER, values VARCHAR);

statement ok
ALTER TABLE partitioned_tbl SET PARTITIONED BY (part_key);


statement ok
INSERT INTO partitioned_tbl SELECT i%2, concat('thisisastring_', i) FROM range(5) t(i)

query I
select count(*) FROM ducklake_metadata.ducklake_partition_info
----
1

# This should do nothing
statement ok
ALTER TABLE partitioned_tbl SET PARTITIONED BY (part_key);

query I
select count(*) FROM ducklake_metadata.ducklake_partition_info
----
1

# A redundant partition change in a transaction that also writes files should keep
# using the existing partition id.
statement ok
BEGIN;

statement ok
ALTER TABLE partitioned_tbl SET PARTITIONED BY (part_key);

statement ok
DELETE FROM partitioned_tbl WHERE part_key = 0;

statement ok
INSERT INTO partitioned_tbl VALUES (0, 'replacement_a'), (0, 'replacement_b');

statement ok
COMMIT;

statement ok
SET VARIABLE expected_partition_id = (
    SELECT partition_id
    FROM ducklake_metadata.ducklake_partition_info
    WHERE table_id = 1
);

query I
SELECT COUNT(*)
FROM ducklake_metadata.ducklake_data_file
WHERE table_id = 1
  AND end_snapshot IS NULL
  AND partition_id IS DISTINCT FROM getvariable('expected_partition_id');
----
0

query I
SELECT COUNT(DISTINCT partition_id)
FROM ducklake_metadata.ducklake_data_file
WHERE table_id = 1
  AND end_snapshot IS NULL;
----
1

query I
SELECT MAX(schema_version)
FROM ducklake_metadata.ducklake_snapshot;
----
2

# This should now change the partition, since it's different
statement ok
ALTER TABLE partitioned_tbl SET PARTITIONED BY (part_key, values);

query I
select count(*) FROM ducklake_metadata.ducklake_partition_info
----
2

# This doesn't change, since it's the same
statement ok
ALTER TABLE partitioned_tbl SET PARTITIONED BY (part_key, values);

query I
select count(*) FROM ducklake_metadata.ducklake_partition_info
----
2

# This will now change it, since it's a different order
statement ok
ALTER TABLE partitioned_tbl SET PARTITIONED BY (values, part_key);

query I
select count(*) FROM ducklake_metadata.ducklake_partition_info
----
3

# We can return to a previous partition
statement ok
ALTER TABLE partitioned_tbl SET PARTITIONED BY (part_key);

query I
select count(*) FROM ducklake_metadata.ducklake_partition_info
----
4

# Lets check that multiple tables still works fine
statement ok
CREATE TABLE partitioned_tbl_2(part_key INTEGER, values VARCHAR);

statement ok
ALTER TABLE partitioned_tbl_2 SET PARTITIONED BY (part_key);

query I
select count(*) FROM ducklake_metadata.ducklake_partition_info
----
5

statement ok
ALTER TABLE partitioned_tbl_2 SET PARTITIONED BY (part_key);

query I
select count(*) FROM ducklake_metadata.ducklake_partition_info
----
5

statement ok
ALTER TABLE partitioned_tbl_2 SET PARTITIONED BY (values, part_key);

query I
select count(*) FROM ducklake_metadata.ducklake_partition_info
----
6

# We can remove all partition of a table
statement ok
ALTER TABLE partitioned_tbl RESET PARTITIONED BY;

query I
select count(*) FROM ducklake_metadata.ducklake_partition_info
----
7

# But if it is already empty we nop
statement ok
ALTER TABLE partitioned_tbl RESET PARTITIONED BY;

query I
select count(*) FROM ducklake_metadata.ducklake_partition_info
----
7
